{
  "created_at": "2026-07-29T00:35:10.765468+00:00",
  "environment": {
    "hardware": {
      "architecture": "arm64",
      "chip": "Apple M2 Max",
      "machine_model": "Mac14,6",
      "memory_bytes": 34359738368
    },
    "model_active_memory_bytes": 2149662728,
    "software": {
      "macos": "26.0",
      "mlx": "0.32.0",
      "mlx_transformers": "0.3.0",
      "mlx_transformers_commit": "525ad03ea267b44636c3dc60420c7726f304984e",
      "python": "3.12.9",
      "transformers": "5.14.1"
    }
  },
  "invocation": [
    "mlx-transformers-benchmark",
    "run",
    "--scenario",
    "prefill-512-decode-64",
    "--model",
    "mlx-community/Phi-3-mini-4k-instruct-4bit",
    "--revision",
    "5b3819ed6317784fb20eddeae9bed984f778d0d0",
    "--dtype",
    "float32",
    "--output",
    "<result.json>",
    "--local-files-only",
    "--implementation-revision",
    "525ad03ea267b44636c3dc60420c7726f304984e"
  ],
  "model": {
    "dtype": "float32",
    "id": "mlx-community/Phi-3-mini-4k-instruct-4bit",
    "local_files_only": true,
    "quantization": {
      "bits": 4,
      "group_size": 64,
      "mode": "affine",
      "quantize_input": false,
      "source": "checkpoint"
    },
    "revision": "5b3819ed6317784fb20eddeae9bed984f778d0d0",
    "tokenizer_id": "mlx-community/Phi-3-mini-4k-instruct-4bit"
  },
  "runs": [
    {
      "decode_tokens_per_second": 62.53990691376908,
      "generated_tokens": 64,
      "peak_memory_bytes": 3683152093,
      "prefill_tokens_per_second": 1172.7214016566525,
      "time_to_first_token_seconds": 0.43659133301116526,
      "token_sha256": "5463256804e9a791c9599ca4e274e0c111cd34b8cf2edf20d4ade06f6ad39968",
      "total_seconds": 1.443948125001043
    },
    {
      "decode_tokens_per_second": 61.28497574446885,
      "generated_tokens": 64,
      "peak_memory_bytes": 3683152093,
      "prefill_tokens_per_second": 1198.1054939849398,
      "time_to_first_token_seconds": 0.42734133393969387,
      "token_sha256": "5463256804e9a791c9599ca4e274e0c111cd34b8cf2edf20d4ade06f6ad39968",
      "total_seconds": 1.4553257499355823
    },
    {
      "decode_tokens_per_second": 62.41905029221592,
      "generated_tokens": 64,
      "peak_memory_bytes": 3683152093,
      "prefill_tokens_per_second": 1195.0187314648335,
      "time_to_first_token_seconds": 0.4284451670246199,
      "token_sha256": "5463256804e9a791c9599ca4e274e0c111cd34b8cf2edf20d4ade06f6ad39968",
      "total_seconds": 1.43775241705589
    },
    {
      "decode_tokens_per_second": 62.23567078518842,
      "generated_tokens": 64,
      "peak_memory_bytes": 3683152093,
      "prefill_tokens_per_second": 1194.0299648696018,
      "time_to_first_token_seconds": 0.4287999590160325,
      "token_sha256": "5463256804e9a791c9599ca4e274e0c111cd34b8cf2edf20d4ade06f6ad39968",
      "total_seconds": 1.441081166965887
    },
    {
      "decode_tokens_per_second": 61.81691942214502,
      "generated_tokens": 64,
      "peak_memory_bytes": 3683152093,
      "prefill_tokens_per_second": 1193.8937697208269,
      "time_to_first_token_seconds": 0.42884887498803437,
      "token_sha256": "5463256804e9a791c9599ca4e274e0c111cd34b8cf2edf20d4ade06f6ad39968",
      "total_seconds": 1.4479873339878395
    }
  ],
  "scenario": {
    "definition": {
      "description": "Measure a 512-token prefill followed by 64 greedy decode tokens.",
      "id": "prefill-512-decode-64",
      "max_new_tokens": 64,
      "measured_runs": 5,
      "prompt": "Summarize the design constraints of a private local language-model application, including correctness, reproducibility, memory use, latency, security, and clear evidence for every technical claim.",
      "prompt_tokens": 512,
      "protocol_version": "1.0",
      "seed": 0,
      "temperature": 0.0,
      "warmup_runs": 1
    },
    "sha256": "9765f94534a85806a482e3ba1fd7781627fc960c4cc02afc6795e581353413cf"
  },
  "schema_version": "1.0",
  "summary": {
    "decode_tokens_per_second": {
      "maximum": 62.53990691376908,
      "mean": 62.05930463155746,
      "median": 62.23567078518842,
      "minimum": 61.28497574446885,
      "standard_deviation": 0.5123076051792477
    },
    "peak_memory_bytes": {
      "maximum": 3683152093,
      "mean": 3683152093,
      "median": 3683152093,
      "minimum": 3683152093,
      "standard_deviation": 0.0
    },
    "prefill_tokens_per_second": {
      "maximum": 1198.1054939849398,
      "mean": 1190.753872339371,
      "median": 1194.0299648696018,
      "minimum": 1172.7214016566525,
      "standard_deviation": 10.222488700598404
    },
    "time_to_first_token_seconds": {
      "maximum": 0.43659133301116526,
      "mean": 0.4300053335959092,
      "median": 0.4287999590160325,
      "minimum": 0.42734133393969387,
      "standard_deviation": 0.003731511978601233
    },
    "total_seconds": {
      "maximum": 1.4553257499355823,
      "mean": 1.4452189585892483,
      "median": 1.443948125001043,
      "minimum": 1.43775241705589,
      "standard_deviation": 0.006787796285660234
    }
  }
}
