{
  "created_at": "2026-07-29T00:33:16.940729+00:00",
  "environment": {
    "hardware": {
      "architecture": "arm64",
      "chip": "Apple M2 Max",
      "machine_model": "Mac14,6",
      "memory_bytes": 34359738368
    },
    "model_active_memory_bytes": 2149662600,
    "software": {
      "macos": "26.0",
      "mlx": "0.32.0",
      "mlx_transformers": "0.3.0",
      "mlx_transformers_commit": "525ad03ea267b44636c3dc60420c7726f304984e",
      "python": "3.12.9",
      "transformers": "5.14.1"
    }
  },
  "invocation": [
    "mlx-transformers-benchmark",
    "run",
    "--scenario",
    "short-decode-128",
    "--model",
    "mlx-community/Phi-3-mini-4k-instruct-4bit",
    "--revision",
    "5b3819ed6317784fb20eddeae9bed984f778d0d0",
    "--dtype",
    "float32",
    "--output",
    "<result.json>",
    "--local-files-only",
    "--implementation-revision",
    "525ad03ea267b44636c3dc60420c7726f304984e"
  ],
  "model": {
    "dtype": "float32",
    "id": "mlx-community/Phi-3-mini-4k-instruct-4bit",
    "local_files_only": true,
    "quantization": {
      "bits": 4,
      "group_size": 64,
      "mode": "affine",
      "quantize_input": false,
      "source": "checkpoint"
    },
    "revision": "5b3819ed6317784fb20eddeae9bed984f778d0d0",
    "tokenizer_id": "mlx-community/Phi-3-mini-4k-instruct-4bit"
  },
  "runs": [
    {
      "decode_tokens_per_second": 71.17293130606205,
      "generated_tokens": 128,
      "peak_memory_bytes": 2361995173,
      "prefill_tokens_per_second": 990.4699456032091,
      "time_to_first_token_seconds": 0.06461579201277345,
      "token_sha256": "60beef5824d40d9c02f7dc131baa81d73e8bf261f6d77727643f78c3f051c57d",
      "total_seconds": 1.849002042086795
    },
    {
      "decode_tokens_per_second": 70.71421239807997,
      "generated_tokens": 128,
      "peak_memory_bytes": 2361995173,
      "prefill_tokens_per_second": 1006.2062472390935,
      "time_to_first_token_seconds": 0.06360525009222329,
      "token_sha256": "60beef5824d40d9c02f7dc131baa81d73e8bf261f6d77727643f78c3f051c57d",
      "total_seconds": 1.8595667080953717
    },
    {
      "decode_tokens_per_second": 72.48617104042371,
      "generated_tokens": 128,
      "peak_memory_bytes": 2361995173,
      "prefill_tokens_per_second": 994.0029770160212,
      "time_to_first_token_seconds": 0.06438612507190555,
      "token_sha256": "60beef5824d40d9c02f7dc131baa81d73e8bf261f6d77727643f78c3f051c57d",
      "total_seconds": 1.8164444580907002
    },
    {
      "decode_tokens_per_second": 71.75024699202511,
      "generated_tokens": 128,
      "peak_memory_bytes": 2361995173,
      "prefill_tokens_per_second": 1016.5957992479393,
      "time_to_first_token_seconds": 0.06295520800631493,
      "token_sha256": "60beef5824d40d9c02f7dc131baa81d73e8bf261f6d77727643f78c3f051c57d",
      "total_seconds": 1.832983958069235
    },
    {
      "decode_tokens_per_second": 73.01359892747556,
      "generated_tokens": 128,
      "peak_memory_bytes": 2361995173,
      "prefill_tokens_per_second": 1010.9300339863267,
      "time_to_first_token_seconds": 0.06330804096069187,
      "token_sha256": "60beef5824d40d9c02f7dc131baa81d73e8bf261f6d77727643f78c3f051c57d",
      "total_seconds": 1.8027100409381092
    }
  ],
  "scenario": {
    "definition": {
      "description": "Measure a 64-token prefill followed by 128 greedy decode tokens.",
      "id": "short-decode-128",
      "max_new_tokens": 128,
      "measured_runs": 5,
      "prompt": "Explain grouped-query attention and why it reduces inference memory.",
      "prompt_tokens": 64,
      "protocol_version": "1.0",
      "seed": 0,
      "temperature": 0.0,
      "warmup_runs": 1
    },
    "sha256": "80d2e0efb6f6d0580b9aedd402162ab67214c007c5720d8d46a96a4aa2875b20"
  },
  "schema_version": "1.0",
  "summary": {
    "decode_tokens_per_second": {
      "maximum": 73.01359892747556,
      "mean": 71.82743213281329,
      "median": 71.75024699202511,
      "minimum": 70.71421239807997,
      "standard_deviation": 0.9373520775481595
    },
    "peak_memory_bytes": {
      "maximum": 2361995173,
      "mean": 2361995173,
      "median": 2361995173,
      "minimum": 2361995173,
      "standard_deviation": 0.0
    },
    "prefill_tokens_per_second": {
      "maximum": 1016.5957992479393,
      "mean": 1003.641000618518,
      "median": 1006.2062472390935,
      "minimum": 990.4699456032091,
      "standard_deviation": 11.111992332260217
    },
    "time_to_first_token_seconds": {
      "maximum": 0.06461579201277345,
      "mean": 0.06377408322878182,
      "median": 0.06360525009222329,
      "minimum": 0.06295520800631493,
      "standard_deviation": 0.0007069875438081959
    },
    "total_seconds": {
      "maximum": 1.8595667080953717,
      "mean": 1.8321414414560422,
      "median": 1.832983958069235,
      "minimum": 1.8027100409381092,
      "standard_deviation": 0.02318263122108004
    }
  }
}
